Reviewer,Title,Review_Text,Rating,Date_of_Travel,Sentiment
shirleyk20,Kenya Airways much preferred over other airlines,"We have travelled to Nairobi 8 times in the last few years... Booking assistance is simple, though.",4,Mar-24,Positive
Oriedo F,Not putting families together automatically is wrong.,My family of four flew from JFK... Boo to this policy for Kenya Airways!,3,Jun-24,Negative
nataliekA1377,Insecurity on an a flight???? Really?,Honestly for an airline with many flights... It is rather upsetting,2,Jun-24,Negative
Annemiek D,Delay,Arrival and departure flight were both delayed... delay was 3 hours for a 1.15 hours flight.,2,May-24,Negative
surbhit28,Best airlines,Kenya airways is one the best airways... will highly recommend this to everyone one..,5,May-24,Positive
stephen m,Great staff personnel,It was really sad when I received an email... she is so professional.,4,May-24,Positive
Lilleax93,Ok but not the best,Overall flight was good but nothing special... we had no choice as this was booked through a 3rd party.,3,May-24,Neutral
Jamal A,Perfect,On the 25 May 2024 my flight was cancelled and postponed... I am disciplined soldier who wishes he was on every flight I take with the airline.,5,May-24,Positive
Vanessa M,Beautiful experience on board but unpleasant experience during check in,I'll give my flowers to the Service on board... You should up your game Sharleen!,3,May-24,Neutral
Neil M,Average,We actually travelled AMS-NBO-SEZ-NBO-LHR on 4 flights total... and I know the Kenyans are very happy people!,3,May-24,Neutral
kolehrees456,Kenya airways.,Very nice flight and amazing service! Staff were very helpful and food was great! The televisions had a great range of movies and no luggage lost on the way or the way back. 5 stars 👍🏽,5,Mar-24,Positive
Tourist4114314...,Family holiday to remember,I have flown with my wife and children on holiday for 3 weeks from 19 March - 11 April 2024. Service was friendly and excellent and will recommend Kenya Airways to anyone as an affordable alternative to the mainstream airlines.,5,Mar-24,Positive
CKTGM,Direct flights make up for the drawbacks,"Service was fine, comfortable seats, easy check-in. But revolting meals. No pineapple juice despite Kenya being a primary, world class producer.",4,Feb-24,Mixed
anderspp,Cancelled and rescheduled fairly well handled,"Original flight cancelled with notice a day earlier, 15 hours delay. Compensation with Business Class upgrade. Rescheduled flights on time.",4,Apr-24,Positive
marieCoventry,Pleasantly surprised 1st time using this airline.,"Aircraft was clean, check-in quick & easy. Staff pleasant and polite. Good food. Overall very good experience.",5,Mar-24,Positive
M8420RWshar...,GOOD FLIGHTS AND GREAT STAFF,No problems whatsoever. Friendly staff. On board and connecting flights on time. Only annoyance was luggage collection for re-check.,5,Mar-24,Positive
fd721,Bad airline with no respect,"Flight okay, but paid extra for seat selection which was not honored. Refund refused. Poor customer service response.",3,Jan-24,Negative
127Fred,A Pride of Africa,"Eventless, punctual flight. Airline judged positively for stress handling. No major issues noted.",4,Mar-24,Positive
fd721,Terrible airway,Terrible service from Amsterdam to Nairobi. Paid for special seating but not honored. Poor staff interaction. Unresolved refund requests.,2,Jan-24,Negative
Phil R,Kenya Air not as bad as expected.,"Friendly staff, on time flights. Comfortable seats, decent food. Only issue was lack of jetways at some airports.",4,Feb-24,Positive
africanman_8,An unnecessary surcharge,"My flight was just fine. Kenya Airways continues to show improvement. I will definitely be flying on Kenya Airways in the future. I am giving Kenya Airways this poor rating because they charged me for excess baggage, they could have been more tolerant.",3,Sep-23,Neutral
jillsC3266RR,Great flight,Great flight. Punctual. Very friendly and efficient staff. Good food. Nothing to dislike. Would definitely use again.,5,Jan-24,Positive
Philip A,Exquisite Airline,The service on board this flight from Nairobi to London was exquisite. Rueben and his team made me and my family feel extremely comfortable and welcomed. The food was delicious and it made it even harder saying goodbye to the beautiful country of Kenya.,5,Dec-23,Positive
Peace A,Nice,They are helpful. They listen to you and try to understand you. They have quality customer service. They also try to satisfy their customers.,4,Feb-24,Positive
PHDBL,Technically the planes functioned well. Generally onboard staff did not seem bothered about non working equipment.,"The departure flight from Johannesburg to Nairobi was delayed twice and the plane downgraded. Actual flights fine. Return flight from Amsterdam had equipment missing, remotes for our screens and the sound did not work.",3,Jan-24,Neutral
Blessed B,Thanks for an amazing time in the friendly skies.,"I flew from Nairobi to Dubai. Special thanks to Chege and another gentleman. Crew was very helpful, checked on a toddler, provided baby’s water bottle, executed duties well and professionally.",5,Dec-23,Positive
Darryl R,The Pride of Africa,"The quality of service, friendliness of cabin crew, in flight entertainment and food served is as good, if not better, than most more expensive airlines.",5,Nov-23,Positive
judithbridget,Awesome,The service is awesome and the items for sale are good quality. Can we have a change of the sandwiches to something else...,4,Nov-23,Positive
Anders P,Passengers could have been better treated,"Kigali to Dar via Nairobi. Enjoyed lounges and service. Nightmare during delay and reroute from Nairobi due to aircraft issue, no announcements, poor management.",3,Sep-23,Negative
C7898GDrobe,Lovely flight,"Lovely flight, on time, staff excellent, great food. Compared positively to British Airways.",5,Nov-23,Positive
Scott G,Thank you Kenya Airways,Fantastic service. Four different flights and all were on time and the service was excellent.,5,Jul-23,Positive
africanman_8...,An unnecessary surcharge,Flight was fine but rated poorly due to surcharge for excess baggage.,3,Sep-23,Neutral
annita m,Kenya airways to kenya,"Arrived and departed on time, basic inflight food and entertainment.",4,Oct-23,Positive
georgie510,Excellent airline,"New Dreamliner, good food and service, all on time.",5,Oct-23,Positive
GBfroggy,Excellent experience,"Excellent service, clean aircraft, great cabin crew, flights on time.",5,Aug-23,Positive
Road6850078...,THE FLEXIBILITY IS INCREDIBLE,Extremely flexible and easy booking. Impressed with the service.,5,May-23,Positive
360Explorers,Good Service,Supportive in changing flight dates. Good service overall.,5,Sep-23,Positive
alanbU7087NY,Kenya Airways,Pretty good service with minimal delays.,4,Sep-23,Positive
RocklandMom,Thirsty Thirsty Flight,Flight was fine but criticized the lack of water provided.,3,Aug-23,Neutral
HappiDayzTr...,KQ is simply amazing,"Flights on time, good service, and luggage handling.",4,Jul-23,Positive
Yasmine,"Thank you, it was a great flight",Perhaps one of the best flight experiences I’ve had in a long time. A short journey but it couldn’t have gone smoother. Thank you so much to the pilot and crew.,5,Jun-24,Positive
Oriedo F,Not putting families together automatically is wrong.,My family flew from JFK to Nairobi on Kenya Airways. Direct flight was a plus. But we weren’t seated together and KQ insisted we pay more. Very frustrating.,3,Jun-24,Negative
anderspp,Good and reliable carrier,No delays apart from one flight. Cheap tickets. Good baggage allowance. Got frequent flyer miles.,4,Aug-24,Positive
Msafi C,Seamless customer service,Amazing customer service from Jackie and Talava. Keep it up!,5,Sep-24,Positive
anderspp,Stability...!,"Flights were on time, good lounge, meals okay. Enjoyable business class flight overall.",4,Aug-24,Positive
ahmideusz,"Ground Operations need to match Flight, Food & Crew","Flight delays, poor coordination on ground. Great onboard service but ground services ruined the experience.",2,Jul-24,Negative
cqfp123,Good experience except for extremely slow airport check-in,Check-in was painfully slow but rest of the experience was smooth and punctual.,3,Jul-24,Neutral
Jen L,Easy way to fly from the USA to Kenya!,Direct flight from JFK. Not luxurious but efficient. Friendly staff. Recommended.,4,May-24,Positive
Trip12260847182,Never again!,"Flight was delayed, poor food, staff disorganized, broken seats. Worst flying experience.",2,Jun-24,Negative
Kwame K,The Pride of Africa,Excellent crew and smooth flight. KQ is improving. Proud to fly with them.,4,Jul-24,Positive
