Reviewer,Title,Review_Text,Rating,Date_of_Travel,Sentiment
Voyage03531...,I can't imagine a worse experience,"Just had the most shocking experience with Kenya airways. After checking my email and their website before departing for the airport, we arrived to find the flight had been cancelled with no notification. The excuse they gave was a sick pilot but research on reviews shows that KA routinely cancel flights that aren't full. Those who had booked through 3rd party suppliers actually had an upper hand as they got a couple of hours more notice. The next available flight was indirect but other passengers got there first despite promises by Kenya airways we were being booked on. We found out 5 hours later they never booked us on. They said their shift is finishing and someone will call me in the afternoon (8 hours later!!). They suggested going on their own flight 2 days later but we would miss our connecting flight if we did that and they won't cover lost hotel bills or onward costs. Also they could just cancel that flight again and it was at 3am so another disrupted night wasn't humanly possible. We had to buy an alternative flight from another airline for the following day. Kenya airways do no issue refunds for cancellations or delays unless you cancel your whole booking so that would jeopardise your return leg. They also do not give meal vouchers. Every step of the way they have been really bad. I honestly cannot believe this airline is still functioning. I suggest all prospective passengers choose alternative airlines so this one can just fail as it's meant to. If you must go with KA ensure you have good travel insurance and don't plan connecting flights close to the time - leave at least 2 days gap. Also don't have any expectations.",1,Jan-25,Negative
Ravi V,Nightmare experience,"Worst experience ever, airlines issued a boarding pass for Nairobi-Johannesburg flight, only to realise after arriving at Nairobi that all the passengers from.Mumbai are put in a different flight scheduled after 10 hours. This is not the first time, I have had many bad experiences with Kenyan airways for some.reason or the other. No one takes the responsibility. Their operations are a nightmare. No further travelling with Kenya airways and strongly suggest others not to opt for it.",1,Jan-25,Negative
B1514JNesther...,Cabin Crew CHOPDEKAR was exceptional.,"KQ003 JFK-NBO 30th December, ""Zambezi River"" was excellent. To be honest I expected the worst after reading a lot of negative reviews but turned out very good. Though groups staff at JKF could use more customer care training. Also on the flight, cabin crew could do better on customer relations, however one staff was exceptional; CHOPDEKAR, he was truly the defination excellent customer service.",4,Nov-24,Positive
Trevor G,The worst flying experience I’ve ever had,"Kenyan Airways is the worst Airline you can possibly use to travel. The most unprofessional service when it comes to booking flights and communicating with passengers. They changed my flight THREE times and didn’t communicate with the connecting airline. Left me and my mother stranded at an airport in New York to fend for ourselves. If you value your time and flying experience, I recommend you never book this airline. It’s literally a joke and the airline should be canceled completely due to its extreme unprofessionalism.",1,Dec-24,Negative
Thecatsmum4,Pleasantly surprised but entertainment not working!,"We were limited to airlines given our destination and the business class cost was reasonable with Kenya so we opted for that. It was with trepidation as the reviews were bad re cancelled flights etc, however they were no better for the other options!...The one issue was that the entertainment system did not work in either of our seats... Not good - as entertainment is important on a long flight!!!!",3,Oct-24,Neutral
OntarioBecky,Awful,Never ever fly with this shambles of an airline...Never ever again will we fly Kenya Airways,1,Dec-24,Negative
Börge E,Cold but i score a strong 4 out of 5.,"Very cold during the 9 hour flight. Bring varm clothing. T-shirt and the blanket given is not enough. Good legroom, several food chooses. Old entertainment system and seats. Overall, cold but a nice trip",4,Dec-24,Positive
Amina M,"KQ changed my flight to a later flight, but staff told me I will it be able to connect due to time","My KQ 625 flight was changed to Jambo jet, hence time change from 4:20 to 6:30 am by Kenya airways. I got to the airport 3:30 am for my 6:30 flight. KQ staff did not want to take responsibility stating I was late. I had to show them several emails from KQ for the changes. I had a severely disabled grandson with me. Who does not communicate. KQ staff were not very sympathetic unfortunately. They told me they would rebook me for tomorrows flight as if I went with the changed flight I would not be able to connect to the London bound flight. I told them I could not just leave without any proof, and they got angry because I did not trust them. I have emailed them, I will update you on their response",1,Dec-24,Negative
jhbdiane2015,Don't go Kenya Airways,"Shocking shocking shocking airline. Do not use unless you want travel delays, cancelations, poor and indifferent service. What should have taken 18hrs travel time took 48 hrs ( each way). Totally terrible service. Take this airline at your own risk … you have been warned!",1,Dec-24,Negative
Kimmi_IslandL...,Do not fly with Kenya Airways!,"Worst airline I have ever flown with. Service is terrible, food is inedible and there is not enough food for the passengers onboard, beverage options are limited. Flights were delayed both ways, airline could not give us boarding passes, passed from 3 different queues in which staff were unhelpful and sent us to to another queue only to get the same result. Finally got boarding passes and my husband and I were seated far from each other, when raising this with the staff, they simply said there was nothing they could do. Definitely would not book with this airline again",1,Dec-24,Negative
Resort365827...,Worst airline in the world,A Joke of an airline. Doesn’t print my boarding pass in Zanzibar and then it literally takes them 2 hours to print my boarding pass in Kenya. Flight is always delayed. Never flying ever again by Kenya Airways.,1,Dec-24,Negative
simranraja3,BE AWARE- DO NOT FLY THIS AIRLINE 0/10,"HORRIBLE EXPERIENCE!!! 0 customer service, no help, flight cancelled, clients stranded… AVOID THIS AIRLINE AT ALL COSTS, -5/10 would NEVER recommend",1,Dec-24,Negative
Barbara Aba Y,Failure to pay refunds.,"I purchased a ticket and made cancellations the same day, and it’s been over two months but they’ve to refund my money. Anytime I contact them they keep giving me one story or another. I’m going to take this up legally……",1,Oct-24,Negative
mvdheerik,Guaranteed cancellation,Worst flight ever. Have booked this flight for staff 4 times now demand every time there was a delay or a cancellation. Be very aware before booking with this company!!!!!,1,Dec-24,Negative
AjithD34,Always changing flight details and aircrafts,Absolute terrible. You book a certain flight with a certain aircraft and Kenya Airways continuously change the aircraft. We went from a Boeing Dreamliner to a small Winglets plane. These plane are changed without any notification. I understand that things change but the smaller aircrafts have no inflight entertainment. They then make you pay for seats together. They allocated seats that split my family and said I must pay to sit together and they say there's nothing they can do.,1,Dec-24,Negative
James P,Useless,Literally the worst airline on the planet. Incapable of being on time and so completely useless that you end up missing your connecting flight. Every time. Frack these guys. Avoid like the plague.,1,Nov-24,Negative
Murugi L,Rude cabin crews and checkin staff are not friendly either,"The staff are rude ,very incompetent,we travelled with my family in August ,,the flight was so hot ,we stayed in Heathrow for over one hour in the heat ,no water, no nothing ,then when you request for something they take so long,some of the female staff are extremely rude ,they feel very entitled .I would never recommend this flight to anyone.",1,Jul-24,Negative
Martinet B,Worst airline ever,"This is the worst airline ever. First flight got delayed and got booked on another flight, alternative flight was also delayed. Then they did not transfer out bags so we were left with lost baggage as well. Their Whatsapp support line is so slow and not efficient. They are so incompetent. Will never use them ever again.",1,Dec-24,Negative
Steve L,Africa has no reason to be proud of Kenya airways,"I would not recommend this flight. Horrible time management and very bad customer service. Poor communication. Also some idiot called frank at the help desk in JKIA is as bad as the flight very rude to customers, and inconsiderate. Kenya airways should.not be used i repeat do not use it.",1,Dec-24,Negative
Guide029957...,Worst Airline,"Worst Airline Ever!!!!! Do not book with them!!! Incompetent, no help at all. Baggage is lost for x10 people. No one can help us!!!!",1,Dec-24,Negative
jonathan l,"Damaged suitcase, no compensation","They damaged our suitcase beyond repair. We reported it immediately at the airport. Filed a claim on line. FOUR months later, they are refusing to honor their own policies. Will never fly this airline. BEWARE",1,Aug-24,Negative
landstuhl,Worst airline ever,"Miserable staff, dirty cramped planes, no hand-wash in toilet on return flight despite asking 3 times, meal choices ran out and food was terrible, no in flight entertainment available...just told to download it to your phone, did not want to put window blinds down but air crew tried to force it down by leaning across to shut it, worst long haul flight evr taken...don't travel with them.....",1,Nov-24,Negative
Tiwonge C,Kenya Airways don't care,"Unless it's a life-or-death situation, or maybe it's the only airline that has remained on earth, please, and I repeat, don't fly using Kenya Airways. They only announced the delay at check-in. The flight, originally scheduled to depart at 1 am, now departs at 4 am and I have to incur cost of the delay. KQ has no regard for customers and the sad part is they know it but they don't care",1,Dec-24,Negative
smvNYC,"Modified flights, lack of of customer support","We had booked a two-leg ticket with a 27 hrs stopover in Nairobi. The airline decided to change move our first leg such that we were leaving 24 hours later and we now had this first leg 2 hours longer. We thus had to find a hotel room, eat up cost of lodging and loose ETA costs. Airline was non responsive when contacted. Less than an hour transfer time in Nairobi, we were ignored.",1,Dec-24,Negative
M K,Horrible!,First time flying with kq and only reason I opted for them over other airlines was because of the extra baggage allowance. Crew didn't have milk for my toddler even though we booked it. 2 out of 6 luggage were ripped. Took 3 weeks for fix after complaint. Will never fly KQ again.,1,Oct-24,Negative
Glen B,"As bad as an airline gets, substandard, unprofessional","Unbelievably bad airline. Substandard, unprofessional service. Cancel flights without warning or notification and completely disinterested with assisting. This airline is a joke. Not that they’d care about bad reviews.",1,Nov-24,Negative
LaWanda B,A laugh of service,"I am very irritated at ONE Male flight attendant. I flew on 12.12.24 at 1015 am from Dar Es Salaam to Nairobi. I have flown akenya airlines several times and never have I been so rudely treated. There were only 2 men on the flight, one named Obote who was a great asset to their team and the culprit who did not have on a name tag. I was seated in 12G in a chair that was slightly reclined. I tried to move the seat up but to no avail. Prior to ttakeoff this unnamed idiot came to me without saying a word to me, and started aggressively trying to move up my seat. It loudly stated that the seat would not move up to its proper place. He turned away rudely. I mentioned his ill behaved manner to Obote who apologized on his colleagues behalf. This she bustard came to me when doing dutyfree and put the magazine in my face without asking if I wanted duty free. I gave it back. Not sure if he has a problem with his mother or other women but I have never seen this type of exist behavior before in all of my travels worldwide. I already had to deal with a delayed and cancelled flight and now this behavior. I won't be recommending this 'pride of africa' airline to any of my colleagues.",1,Dec-24,Negative
Gustave C,Kenyan airways asked another 400 usd for my ticket on departure.,"Kenyan airways cancelled my ticket and I had to pay 400USD to make it valid again. Their argument: I bought two tickets for my trip from Mombasa to Nairobi and used only one, so I had to pay a penalty.",1,Dec-24,Negative
busib2015,Worst airline experience of my life.,I travelled home to SA from Nairobi 2 days ago and woke up still angry about the treatment I received off Kenyan airways staff. The girls were so unbelievably rude & hostile - ground and air hostesses. The only reason I’ll fly this airline again is because there’s scant choice in that region.,1,Dec-24,Negative
Odyssey6570,Worst experience I've ever had with an airline,"I just returned from a trip from Toronto to Uganda. I fly multiple times a year, and this was my first and last time flying with Kenya Airways. On my way to Africa they opened my luggage and went inside all of my travel cubes and toiletries, leaving all containers and pockets opened. As a result, my shampoo and conditioner went all over my stuff, including my medication. It's been 4 weeks, multiple emails and phone calls and nobody has been able to provide me with an answer or any type of compensation for this. Their customer service is absolutely awful. I fly to Africa regularly and will never fly with this company again. Save yourself a headache and book with another airline.",1,Nov-24,Negative
Julieclarotfos,AVOID PLEASE,"My experience with Kenya Airways has been an absolute nightmare: - Flights repeatedly changed and canceled with no proper alternatives. - Travel duration never ending, not knowing when we would head back home, we have been completely left in the dark for hours and had to book another route on our own - Lost luggage that took me a month to get back, - Customer service useless and dismissive. They've been stringing me along for over a year (started in december 2023), giving half-baked responses or completely irrelevant ones, clearly stalling in the hopes that I'd give up. Kenya Airways finally came up with a “compensation” : a laughable €90 voucher which I NEVER RECEIVED – a complete insult. I had seen bad reviews before, I definitely should have believed them. This company shows zero respect for its customers. Think twice before booking with them—you deserve better!!!",1,Jan-24,Negative
Odyssey6570...,Worst experience I've ever had with an airline,"I just returned from a trip from Toronto to Uganda. I fly multiple times a year, and this was my first and last time flying with Kenya Airways. On my way to Africa they opened my luggage and went inside all of my travel cubes and toiletries, leaving all containers and pockets opened. As a result, my shampoo and conditioner went all over my stuff, including my medication. It's been 4 weeks, multiple emails and phone calls and nobody has been able to provide me with an answer or any type of compensation for this. Their customer service is absolutely awful. I fly to Africa regularly and will never fly with this company again. Save yourself a headache and book with another airline.

As other comments have mentioned, they will also change your fly time constantly.",1,Nov-24,Negative
Julieclarotfos...,AVOID PLEASE,"AVOID AT ALL COSTS, COMPLETE FRAUD

My experience with Kenya Airways has been an absolute nightmare:
- Flights repeatedly changed and canceled with no proper alternatives.
- Travel duration never ending, not knowing when we would head back home, we have been completely left in the dark for hours and had to book another route on our own
- Lost luggage that took me a month to get back,
- Customer service useless and dismissive. They’ve been stringing me along for over a year (started in december 2023), giving half-baked responses or completely irrelevant ones, clearly stalling in the hopes that I’d give up.

Kenya Airways finally came up with a “compensation” : a laughable €90 voucher which I NEVER RECEIVED — a complete insult.

I had seen bad reviews before, I definitely should have believed them.

This company shows zero respect for its customers. Think twice before booking with them—you deserve better!!!

Clarot Julie",1,Jan-24,Negative
itten2018,"Not the pride of Africa, but the shadow of Africa","As a Flying Blue Silver member, this is the second time we have flown Business Class with Kenya Airways.
Last year in 2023 everything went smoothly and we were satisfied with the airline.
This year 2024, Kenya Airways first postponed our flight from Paris to Nairobi by half a day. Instead of 8:30 pm to 11:00 am This was ok as they gave us about 3 weeks notice. Nevertheless, in our case we had to book a hotel in Paris.
During our trip, Kenya Airways then canceled our connecting flight from Nairobi to Zanzibar. This resulted in a transit time of 10 hours through the night in Nairobi.
Instead of organizing everything for the passengers, they wanted us to fill out an e-visa for Kenya on our own so that we could get to a hotel. It was already close to midnight and we were just tired and the program for the visa application kept throwing us out. After an hour, we abandoned the exercise and spent the night at the airport.
Kenya Airways has been canceling their flights a lot lately and the way they handle this is not at all professional.
The inflight product and crew are friendly and professional. But what is with the management and operation is more than sad and unacceptable.
We didn't even get any compensation and or a sincere apology.",1,Nov-24,Negative
Jacqueline E,KQ Pride of Africa,"Great service with polite and attentive staff, clean cabin with tasty meals. I enjoyed the flight and will fly KQ again.",1,Oct-24,Negative
Global4143571...,Pure fraud,"We decided not to take our first flight from Nairobi to mombasa. We looked on the kenya airways website on how to notify of our absence or cancel our flight, but we were told we could only cancel our full round trip or nothing at all, so we did not cancel. When we showed up for our return flight from Mombasa, we were told that our return tickets had been canceled without notification because we did not cancel our first flight (read above: not an actual option), that the flight was full, and that if we wanted a new flight we would be charged the cost of the new flight plus a change fee. We cut our losses and booked with a new airline.

To sum up:
1. Kenya airways lied to us about their no-show policy,
2. Cancelled our reservation without telling us (we asked, and this is their deliberate policy),
3. Tried to gouge us for even more money.

Thieves. Fraud. Stay away.",1,Nov-24,Negative
Bok C,Delays,"Extremely poor, delays, with no explanation and within short notice..pathetic. I think it's unfortunate that KQ suddenly delays flights, which is sad. I thought I would not have this experience but it's just horrible",2,Nov-24,Negative
Luke U,Terrible inconsistencies,I wanted to take my guitar on a Kenya Airways flight and called ahead to make sure that it was possible. [...] I did not get that at all.,2,May-24,Negative
Jesca M,Worst service and carelessness to passengers luggages,"This my second time using Kenyan Airways, [...] I also hope I will get my bag with every single thing I packed in there.",2,Nov-24,Negative
Raymond B,Bad experience,I really wanna inform I have had the worst experience [...] Very poor.,2,Nov-24,Negative
irma s,"BAD SERVICE, and beware they forgot your luggage, and refusing paying compensation",Luggage delayed for more than 40 hours. [...] more than 40 hours!!!,2,May-24,Negative
Amac12345678,Terrible customer service and support,"Charged $150 to update a name from ben to benjamin, due to spell check. Unable to contact anyone and were unable to travel unless paying this fee",2,Oct-24,Negative
biGmo99,I might be one of the lucky ones,C'mon guys. I flew with KQ a couple of times recently. [...] Thank you Kenya Airways,4,Oct-24,Positive
Z6809LFsilviam,Very bad company,"Worst experience ever. Delays over Delays with no explanation, [...] Never again.",2,Nov-24,Negative
Relax5473474...,Delay flight & service,Very very terrible.....not like fly service....child very struggling....very bad service...flight 24 hours delay ......tourist plan destroyed....very bad experience,2,Oct-24,Negative
H9728CGrac...,Delays Delays Delays,I travel on Kenyan Airlines from JNB to DSS on Saturday 26th October. [...] 8 hours after the arrival time.,2,Oct-24,Negative
Paul R,London > Nairobi 2024,London to Nairobi (and return) Business class KQ101 & KQ100 September 2024 Overall 9/10 in its peer group. Choice of BA or Kenya. Picked Kenya because I don’t like the new squashed in business class suites on BA. I also find their in flight food unacceptably poor these days.,5,Sep-24,Neutral
NeilSchier,Lost glasses and true service,Flight from Victoria Falls to Cape Town. Plane was clean and tidy with good seating. My wife left her new reading glasses on plane. We went back to Cape Town airport 4 days later and were surprised and relieved when we were able to recover the glasses. Thank you for your service.,5,Aug-24,Positive
Msafi C,Seamless customer service.lome was not built in a day.keep it up,Amazing customer service from Jackie and Talava.your a true legend to the pride of Africa.keep it up!excellent service,5,Sep-24,Positive
Anders P P,Stability...!,"Travelled Paris to Joburg through Nairobi 23-24th August 2024 on B787 and B737, respectively. All flights on time. Checked in with breeze in CDG and went to the excellent lounge in Terminal 2E Hall K.",4,Aug-24,Positive
Ahmideus Z,"Ground Operations need to match Flight, Food & Crew","Flight out of Nairobi left late. No announcement. At the last minute the gate changed, no announcement again.",3,Jul-24,Neutral
cqfp123,Good experience except for extremely slow airport check-in,"Check-in was supposed to open 3 hours before the flight, but didn't open until 20 min later, and pax were made to wait outside of the terminal in the heat.",4,Jul-24,Neutral
Jen L,Easy way to fly from the USA to Kenya!,No issues or delays. The food was good and they had about 3 different meal services each flight. The entertainment was decent too.,4,May-24,Positive
Kwame K,The Pride of Africa,Excellent crew and smooth flight. Kenya airways has improved in recent times and clearly doing great in its services. Truly the pride of Africa,4,Jul-24,Positive
Perfectly Imper... B,"Thank you, it was a great flight",Perhaps one of the best flight experiences I’ve had in a long time. A short journey but it couldn’t have gone smoother. Thank you so much to the pilot and crew. Yasmine,5,Jun-24,Positive
Perfectly Imper... B,"Thank you, it was a great flight",Perhaps one of the best flight experiences I’ve had in a long time. A short journey but it couldn’t have gone smoother. Thank you so much to the pilot and crew.,5,Jun-24,Positive
Oriedo F,Not putting families together automatically is wrong.,"My family of four flew from JFK (New York City) to Nairobi on Kenya Airways trying for the first time this direct flight to Kenya after usually flying through Europe and then to Kenya. The pros: a direct flight, getting to Kenya faster. The service was adequate, the entertainment was adequate.",2,Jun-24,Neutral
anderspp,Good and reliable carrier,My wife flew Kigali via Nairobi to Dar es Salaam (and return) August 2024. A rescheduling of 2nd flight was announced clearly weeks prior to flights so no issues...,5,Aug-24,Positive
Msafi C,Seamless customer service.lome was not built in a day.keep it up,Amazing customer service from Jackie and Talava. you're a true legend to the pride of Africa. keep it up! excellent service,5,Sep-24,Positive
anderspp,Stability...!,"Travelled Paris to Joburg through Nairobi 23-24th August 2024 on B787 and B737, respectively. All flights on time... Crews are always fine, jolly, focused, responsive, and pleasurable.",5,Aug-24,Positive
ahmideusz,"Ground Operations need to match Flight, Food & Crew","So here’s the thing about Kenya Airways:- their flight crew is great, their inflight menu selection and service is great. Sadly the ground operations are far from it and that’s what brings it down...",2,Jul-24,Negative
cqfp123,Good experience except for extremely slow airport check-in,Booked by tour company. Reasonably user-friendly website and app... Check-in was unbelievably slow with each passenger spending 7-10 min at the counter...,2,Jul-24,Neutral
Jen L,Easy way to fly from the USA to Kenya!,Took the direct flight from JFK to NBO and then from NBO to JFK. Had no issues or delays... The food was good and they had about 3 different meal services each flight.,5,May-24,Positive
Trip12260847182,Never again!,"The good parts - there was decent leg room and a TV, and hand towels were handed out after boarding. The bad parts far outweighed the good though - food was inedible, had to practically beg for a cup of water...",2,Jun-24,Negative
Kwame K,The Pride of Africa,Excellent crew and smooth flight. Kenya airways has improved in recent times and clearly doing great in its services. Truly the pride of Africa,5,Jul-24,Positive
