Reviewer,Title,Review_Text,Rating,Date_of_Travel,Sentiment
Culture03633848879,Very BAD.,"Very very bad experience on Kenyan airways on the outbound and inbound. We flew to Nairobi. From there connected to go to Lagos, instead of landing the pilot went up, came back again and instead of landing went up. We landed in Contonou for 5 hours. We weren’t allowed to disembark there. Returning to SA was just as bad. The pilot announced we need to turn back to Nairobi after being in the air for about 1:30min. People who missed connecting flights were not refunded. We slept on the bench till morning waiting for a new flight that was to leave at 7:45. Don’t book Kenyan airways rather use direct flights or alternatives like SAA. It’s sad that we have to rely on such unreliable airlines when in SA we had real world class.",2,Feb-25,Negative
Nicole N,Worst experience ever.,The absolute worst. Their website and app are awful and not user friendly when trying to check in. I paid for upgraded leg room seats and luckily I printed and saved the confirmation email with my upgraded seats/payments because at check in they made us choose different seats and try to pay again for the ones we had. I would NEVER recommend them. Try flying another airline if at all possible!,1,Mar-25,Negative
Travelbug35805,Good with the bad,"Flight was an Embraer 190 regional jet. We were in first class in the first row. The food was very good and the service was decent. The plane was clean. The one downfall was the fact that after the meal service ended, the crew sat in the galley area chatting and chatting basically through the rest of the flight. Not only did it portray a careless attitude towards the passengers, the noise was distracting, particularly in the front row. Maybe the last row would have been better.",3,Mar-25,Neutral
Maria Z,29 Feb 2025. Microaggressive crew member,"I travelled on 28 th February from Amsterdam to Entebbe and bought business class for myself and kids because I needed extra leg room for my baby who was 2. I was confused by the utter lack of service, compassion and even extremely bad service from the crew members particularly one woman who conveniently took off her badge name but was servicing seats from seats 5B. I was not shown where to change my baby, every time I asked for something like milk or even water, I got nasty looks from this woman flight attendant. I was completely dismayed. I will never be flying this airline again and would not recommend anyone spending so much money more especially on business class. Luckily my connecting flight from Nairobi to Entebbe on 29 th February had more professional crew and the service was miles away from what I got before.",2,Feb-25,Negative
Anders P,4 faultless flights...,"Flew Kigali-Nairobi-Dar and return mid-March 2025. Aircrafts were all on ageing B737-800, except the 1st leg was on the smaller Embraer 190. A flight cancellation was clearly announced 10 days in advance, allowing for alternative and even better options compared to original schedule. All flights on time, FAs, catering and seating were all good. Could select my preferred exit seat free with ample legroom through KQs homepage. Transfers in Nairobi were smooth. Two-three pieces of luggage were received well (both ways). Paid access to lounge in Nairobi discounted to 25 USD due to Silver status with Kenya airways. Miles earned and given, generous luggage allowance, together with the inexpensive ticket make this detour over Nairobi worth the trouble as compared to direct flight alternatives. All flights on time.",5,Mar-25,Positive
gautierm546,"I trusted them as they were part of Syteam, DON'T DO THE SAME MISTAKE.","KenyaAirways lost my luggages, no info for 5 days, and when somehow they reappear (although I have twice to go to the airport to recover them, which also costed me money), again 0 response regarding a fair first necessity compensation for buying clothes. I was in flip flop in winter in Europe with no spare boxer, no spare socks... I trusted them as they were part of Syteam, DON'T DO THE SAME MISTAKE.",1,Feb-25,Negative
Relax786453,WORST,"THE WORSE CUSTOMER SERVICE I HAVE EVER HAD. EACH REP LIE AND POINT FINGERS. NO ONE IS WILLING TO ASSIST AND SOLVE THE ISSUE. NO EMPATHY FOR ELDERLY TRAVELLING. 18 HOURS DELAY WITHOUT GIVING ANY ACCOMODATION, 6 CALLS TO CUSTOMER SERVICE, TRANSFER DESK AND THE LOUNGE AND ALL OF THEM WOULD NOT MAKE A SIMPLE DECISION TO ACCOMODATE A CUSTOMER RATHER STATING WE NEED AN EMAIL TO DIRECT US TO PROVIDE ACCOMODATION AND NO ONE COULD WRITE SUCH EMAIL. WORSE EXPERIENCE EVER",1,Mar-25,Negative
melissarouxnc,They charge me extra at the airport,"They charged me an extra 55 USD for my luggage, even thought I’ve paid for the 30kg suitcase. In South Africa, they didn't charge me, but in the transit in Kenya they wouldn't let me go - even thought my suitcase was not even with me!",2,Mar-25,Negative
Mihail M,"Never use this airline, unless you hate yourself","The organization skills of this airline is terrible. My flight was cancelled in front of my eyes, just because the airplane got full. I was placed on a hotel, which was with bad service. The transport was extremely terrible and unsafe. Nothing works on schedule. The only good thing is that the staff speak good English.",1,Mar-25,Negative
Jay's J,Utterly Incompetent - Seat Given Away After Check-In!,"Kenya Airways has demonstrated a shocking level of incompetence. After checking in and receiving my boarding pass, they gave my seat away. I was then left stranded in Kigali for SIX HOURS while they scrambled to find a replacement. This is unacceptable. The lack of communication and disregard for passengers is appalling. Avoid this airline at all costs if you value your time and sanity.",1,Feb-25,Negative
T5043QWcatherinen,Bad Experience with KQ Kenya Airways,"I have heard the worst experience with Kenya Airways... flight cancelled due to operational issues. Processed refund, but later told it changed again. In 2018, they lost my bag. Terrible customer service.",1,Feb-25,Negative
ines c,Excellent experience on a Direct Flight to NBO,"Very happy to have a direct flight from JFK to NBO. Service and food were excellent, no problems with delays or luggage. Best flight experience ever.",5,Feb-25,Positive
Aladin G,WORST AIRLINE! STAY AWAY!,"Bag never arrived, sent 2 weeks later, no responsibility taken. Countless emails with no reimbursement. Will not fly Kenya even if paid.",1,Dec-24,Negative
jon s,Treat you like animals!,"Long delays, no staff, missed connections. Repeated bad service and misinformation. Staff lied, finally checked us in after much drama.",1,Feb-25,Negative
414kittykite,Better than expected!,Flight delay of only 1 hour. Flights on time. Food and service average. Check-in staff helped quickly. Difficult to reach contact center.,3,Feb-25,Neutral
Trail41500013380,Terrible Experience,Missed connecting flight due to delay. Staff unhelpful and disinterested. Bags delayed by two days. Poor customer service overall.,2,Feb-25,Negative
christinevs1,Worst trip ever!!!,Inflight entertainment broken. AC issues made trip very hot. Will never fly Kenya Air again.,1,Feb-25,Negative
Wanderer01982049478,Wrong luggage allowance and rude staff,"Different baggage info given at airport. Forced to pay extra. Staff rude and unprofessional, especially the supervisor.",1,Feb-25,Negative
Moni J,Kenyan Airline,Delayed nearly 10 hours. No lodging or food provided. Missing luggage. Poor communication and bad service. Warn others not to fly with them.,1,Feb-25,Negative
DayTrip24704002444,Room for improvement,"Confusion at check-in, long queues. Miscommunication at the gate. Cabin crew courteous and seamless. Food okay but plastic cutlery was disappointing.",3,Jan-25,Neutral
ElaineG1642,Terrible Customer service and care,"Delayed in Mombasa caused missed connection. 18-hour wait in Dubai, no apology or compensation. No luggage on arrival. Very disappointing experience.",1,Nov-24,Negative
Sightsee47783235201,No online Check in,Check-in issues have persisted for years. Lazy and disrespectful to clients. Site doesn’t keep state. Had to re-enter info multiple times.,2,Feb-25,Negative
Jalilah N,BOOKING KENYA AIRWAYS IS THE WORST THING YOU COULD EVER DO TO YOURSELF,"Everything about this airline is subpar. Dirty plane, no customer care. Staff completely unprofessional. Avoid at all costs.",1,Jan-25,Negative
Stay07610064857,WORST AIRLINE EVER WITH NO CUSTOMER SERVICE!!!!!!!!!!!!,"Long wait to check in. Paid extra for better seats, got nothing. Terrible breakfast, delays, lost connections. No feedback or refund.",1,Dec-24,Negative
Excursion40796791765,Lost luggage & Bad Service,"Lost luggage, employees dismissive. Did the bare minimum to assist. Had to push to get a claim filed.",1,Jan-25,Negative
Mo M,Terrible Airlines,"Lost suitcase, poor service, nearly missed flight. Seatmate situation uncomfortable. Will never fly Kenya Airways again.",1,Jan-25,Negative
Explore63386479286,0,"Very bad experience. Poor timing, commitment. Airport and flight staff behavior was disappointing.",1,Jan-25,Negative
Alvin M,Do not use this airline!,"Lost bags, delays, bad check-in service and poor food. Advised to spend extra for another airline.",1,Jan-25,Negative
Storyteller720625,Not good,"Flight not pleasant. Bad snacks, old seats. Won’t fly with KQ again. Luggage handling poor.",2,Jan-25,Negative
arvinder b,Worst Airline,Flight delayed over 5 hours. Customer service was pathetic and no compensation was offered.,1,Jan-25,Negative
Chipmunk c,Terrible,Cancellation after cancellation. Spent 12hrs in Nairobi with no support. Worst airline on African routes.,1,Jan-25,Negative
Bella B,"Pathetic, worst experience of my life!! Avoid this scammers","Lost luggage, no compensation, terrible food, multiple delays. Staff unhelpful. Worst business class service ever.",1,Dec-24,Negative
953blaithimh,Terrible experience,Delays and missed connections. No compensation. 12-hour wait at Paris. Very poor service and coordination.,2,Jan-25,Negative
Immaculate T,"Ladies and gentlemen, Save yourself a headache",Luggage lost. Staff unhelpful and communication poor. Had to chase for updates. Very frustrating experience.,1,Jan-25,Negative
Penyao S,No assistance provided for flight delay/ cancellation,12+ hour delay. No assistance. Promised compensation never given. Had to follow up for 3 weeks.,1,Jan-25,Negative
Alayka R,First and Last.,Delayed for hours. Poor communication. Stressful and uncoordinated support in Nairobi. Would never recommend.,1,Dec-24,Negative
Ama A,Better off paying more for another flight,Rescheduled flights without proper notice. Office closed at airport. No compensation. Unpleasant travel experience.,1,Dec-24,Negative
jonathan l,Minus 0 rating,Damaged luggage. Took 6 months to get $200. Cancelled return flight. Poor customer service.,1,Aug-24,Negative
Compass43520161804,Refund taking forever!,Waiting for refund over 3 months. Calls yield same response. Embarrassed by the service.,1,Oct-24,Negative
Amani B,So bad,"Awful awful awful. Had our flight delayed 9 hours with no alternative, stayed overnight in the airport. The customer service was terrible. There’s no communication about what’s happening. Worst experience I’ve had with an airline. Laughable they call themselves the ‘pride of Africa’.",1,Jan-25,Negative
Nadia M,Worst ever airline,Worst airline ever. Stood in a row for almost 2 hours to check in. Paid for better seats that was no better. Got a dry bun for breakfast. Flight was delayed for more than an hour.,1,Dec-24,Negative
Mr_Mrs_Jones1,Excellent customer service,Thank you Sanobar for promptly checking in my luggage and checking for leg room seat availability. I hope she gets given a recognition for her excellent customer service.,5,Mar-25,Positive
Sightsee477832,No online Check in,"This airline has been having issues with their check-in for years but they still haven't fixed the bag. I think this is very lazy and disrespectful to their clients. The site also doesn't keep state, you have to give them your information again and again.",1,Feb-25,Negative
Moni J,Kenyan Airline,"Kenya Airlines is one of the worst airlines we've ever flown with. Delayed 10 hours in Nairobi, no lodging or food. Missing baggage, unhelpful staff. We advise boycotting this airline.",1,Feb-25,Negative
DayTrip24704002444,Room for improvement,"Confusing check-in process, long wait times, poor communication, mixed-up flights. Courteous cabin crew, but disappointing airport experience overall.",2,Jan-25,Neutral
ElaineG1642,Terrible Customer service and care,"Missed connecting flight due to delays. No compensation, poor handling of luggage, stressful experience. Will not fly with them again.",1,Nov-24,Negative
Stay07610064,WORST AIRLINE EVER WITH NO CUSTOMER SERVICE!!!!!!!!!!!!,"DO NOT USE THIS AIRLINE. On arrival at OR Tambo we waited for 1 hour 40min just to check in. Only 2 people at the counter and a runner pushing people into the row of people waiting. We paid extra for better seats. DO NOT pay for this. On our flight from Nairobi to Zanzibar they changed the plane to a very small plane. Was difficult to go to the toilet. Dry croissant for breakfast. Return flight also delayed, no benefit for premium seats, no refund despite several emails.",1,Dec-24,Negative
Excursion40796797165,Lost luggage & Bad Service,Lost my luggage and did bare minimum to look for it. Had to consult with three dismissive employees before anyone even filed a claim.,1,Jan-25,Negative
Mo M,Terrible Airlines,"Kenya airlines lost one of my checked bags. Delayed flight due to system error. Poor customer service, nearly missed flight. Terrible 10-hour journey. Very uncomfortable and overcrowded seat. Never flying Kenya Airlines again!",1,Jan-25,Negative
Explore63386702925,0,"Very very bad experience. Timing, commitment & airport and flight staff behavior, it's very bad.",1,Jan-25,Negative
Alvin M,Do not use this airline!,"Lost bags, delays in travel timing, horrible service at the check-in desk, food was not great either. Spend the extra $500 and fly another airline.",1,Jan-25,Negative
Storyteller720625,Not good,The Kenya Airways flight was not pleasant. Terrible flight snacks. Old seats. Won’t fly with KQ again. They could do better with handling luggage too.,2,Jan-25,Negative
David S,A sub par airline,"We left JFK late, missed our connection, had to sit for 11 hours. Food wasn’t good, seats not comfortable. Only Delta helped us out. Wouldn’t recommend unless they improve.",2,Jan-25,Negative
arvinder b,Worst Airline,Flight was delayed over 5 hours and customer service is really pathetic and no compensation was given.,1,Jan-25,Negative
Chipmunk c,Terrible,"Terrible airline, repeated cancellations. No information, spent 12hrs in Nairobi with no support from the airline. Never would I recommend anyone to this airline.",1,Jan-25,Negative
Bella B,"Pathetic, worst experience of my life!! Avoid this scammers","Avoid this. Lost luggage, no compensation. Terrible food, 3hr runway delay, missed connection, no communication. Still no response after a month. Waste of money. Shame on you.",1,Dec-24,Negative
Immaculate T,"Ladies and gentlemen, Save yourself a headache","My luggage was lost during my flight, and the entire process of tracking it was a nightmare. Unhelpful staff, poor communication, no accountability. I won’t be flying with them again anytime soon.",2,Jan-25,Negative
Penyao S,No assistance provided for flight delay/ cancellation,We experienced a delay of over 12 hours. No assistance or compensation despite follow-up for three weeks. Very miserable experience. Never flying with them again.,1,Jan-25,Negative
Ama A,Better off paying more for another flight,Flight time changed multiple times without proper notice. Airport staff were unavailable. Was forced into a 24-hour journey instead of 3 hours. No compensation offered. Terrible experience.,1,Dec-24,Negative
jonathan l,Minus 0 rating,Severely damaged luggage and 6 months for $200 compensation. Return flight canceled without notice. Terrible customer service. Will never fly again.,1,Aug-24,Negative
Compass43520161804,Refund taking forever!,"Been waiting 3 months for a refund. Terrible customer service, same response every time. Very disappointed and embarrassed. Will never use this airline again.",1,Oct-24,Negative
JedEye M,The worst airline in Africa.,Crew refused basic service. Delayed both ways. Staff were unhelpful and rude. Would rather fly anything else. Never again.,1,Jan-25,Negative
Renuka S,KQ chartered to Hi Life,"Flight chartered out, no wifi, poor food and drink service, cramped space. Not business class, felt like cattle class. Disappointing.",1,Jan-25,Negative
GrandTour50...World,Avoid This Terrible Airline,Flight cancelled 6 hours before take-off. Customer service misled us. Had to book new flights ourselves. Refund still pending. Horrible experience.,1,Dec-24,Negative
globetrotting...DC,Never again,"Lost luggage, delays, and poor accountability. Broken handle on bag. Claim process is frustrating. Worst airline I’ve flown.",1,Dec-24,Negative
Dan S,"Never ever fly this airline, EVER!","Delayed flights both ways. No water, no communication. Worst service. Fly any other airline instead.",1,Dec-24,Negative
Chui-Ling,Travel with this airline if you don't mind being scammed!,"None of the entertainment screens were working during the entire 9.5 hour flight. Cabin crew said they hadn't worked for ages and weren't sure whether they'd be fixed. On return journey, we went from Zanzibar to Nairobi... (truncated)",1,Dec-24,Negative
cvmehta2016,Flying Kenya Airways,"Flying business class - Dec 30th. No Entertainment/ No TV screen. Could not watch movies etc for this 6 hr flight. Gave dinner but in morning. No breakfast, not even tea or coffee.",1,Dec-24,Negative
Anna S,"Pay a little extra, avoid flying with Kenya",Booked flights over Christmas from Amsterdam to Zanzibar... (truncated),1,Dec-24,Negative
Go24761357454,"Forced to book a flight, lost carry on lugage, massive delay",Awful experience. They forced me to book an ongoing flight in India before they let me board the plane in joburg... (truncated),1,Dec-24,Negative
Chui-Ling,Travel with this airline if you don't mind being scammed!,"None of the entertainment screens were working during the entire 9.5 hour flight... Never again, will we fly with this dodgy airline!",1,Dec-24,Negative
cvmehta2016,Flying Kenya Airways,"Flying business class- Dec 30th. No Entertainment/ No TV screen. No breakfast , not even tea or coffee.",1,Dec-24,Negative
Anna S,"Pay a little extra, avoid flying with Kenya","Booked flights over Christmas from Amsterdam to Zanzibar, via Nairobi...Pay a little extra, avoid these guys.",1,Dec-24,Negative
Go24761357454,"Forced to book a flight, lost carry on lugage, massive delay",Awful experience...Never again!,1,Dec-24,Negative
Marianelemos,Kenya Airways: The Worst Airline Experience of My Life,Kenya Airways was the worst airline I have ever flown with in my life...I will never fly with them again and I will not recommend them to anyone.,1,Dec-24,Negative
QIAN Y,THE SHAME OF AFICAN AIRLINE,DON'T FLY WITH KENYA AIRWAYS!! THIS IS THE MOST TERRIBLE AND PATHETIC ARLINE EVER!!,1,Jan-25,Negative
Petrus Hendri...,Worse travel experience ever!,"Poor service, flight attendants unfriendly... Very poor experience in all.",1,Dec-24,Negative
Courtney W,"Save your time, book somewhere else!",Do not use this airline...I will most certainly not be recommending it to anyone.,1,Jan-25,Negative
ByronAnthony...,Embarrassment of Africa,Do not ever use this airline...It is shocking.,1,Jan-25,Negative
San-Mari R,Choose another airline!,Terrible experience!...I'll never fly with them again and won't recommend anyone to do so.,1,Dec-24,Negative
Ravi V,Nightmare experience,"Worst experience ever, airlines issued a boarding pass for Nairobi-Johannesburg flight, only to realise after arriving at Nairobi that all the passengers from.Mumbai are put in a different flight scheduled after 10 hours. This is not the first time, I have had many bad experiences with Kenyan airways for some.reason or the other. No one takes the responsibility. Their operations are a nightmare. No further travelling with Kenya airways and strongly suggest others not to opt for it.",1,Jan-25,Negative
Camper481911...,Worst Airline,"My experience with Kenya Airways was deeply disappointing. The total flight delay on BOTH our outbound and return flights exceeded almost 30 hours. We also saw that several other their other flights were also delayed. There were no apologies, no consideration for customers, and a complete lack of empathy. The ground staff in both Johannesburg and Kenya were unprofessional and displayed a 'don’t care' attitude.",1,Dec-24,Negative
ucazzu P,The pride of having no shame,Horrible. Still no refund for the absurd changes they imposed randomly & let no way to to find any compromise. They are just thieves... & apparently so proud to be.,1,Nov-24,Negative
Dale M,Very very bad,Online check in wasn't working... [Truncated for brevity],1,Jan-25,Negative
Voyage03531...,I can't imagine a worse experience,Just had the most shocking experience with Kenya airways... [Truncated for brevity],1,Jan-25,Negative
anisha j,Embarrassment of Africa,They are the embarrassment of Africa and not the Pride... [Truncated for brevity],1,Dec-24,Negative
G8227Wthom...,Horrible airline - avoid at ALL costs,Truly one of the most horrible airlines in Africa right now... [Truncated for brevity],1,Dec-24,Negative
Amani B,So bad,Awful awful awful. Had our flight delayed 9 hours with no alternative... [Truncated for brevity],1,Jan-25,Negative
Nadia M,Worst ever airline,Worst airline ever. Stood in a row for almost 2 hours to check in. Paid for better seats that was no better. Got a dry bun for breakfast. Flight was delayed for more than an hour.,1,Dec-24,Negative
kklaff1234,Kenya Airlines is worlds worst with even worse staff,Worst airline in the world. Do not fly with them... [Truncated for brevity],1,Jan-25,Negative
Ravi V,Nightmare experience,"Worst experience ever, airlines issued a boarding pass for Nairobi-Johannesburg flight, only to realise after arriving at Nairobi that all the passengers from.Mumbai are put in a different flight scheduled after 10 hours. This is not the first time, I have had many bad experiences with Kenyan airways for some.reason or the other. No one takes the responsibility. Their operations are a nightmare. No further travelling with Kenya airways and strongly suggest others not to opt for it.",1,Jan-25,Negative
Camper481911...,Worst Airline,"My experience with Kenya Airways was deeply disappointing. The total flight delay on BOTH our outbound and return flights exceeded almost 30 hours. We also saw that several other their other flights were also delayed. There were no apologies, no consideration for customers, and a complete lack of empathy. The ground staff in both Johannesburg and Kenya were unprofessional and displayed a 'don't care' attitude. Customer service is practically non-existent—reaching them through the call center, WhatsApp, email, social media etc... is impossible. The social media representative, in particular, was rude and unhelpful, raising serious questions about their suitability for the role. The in-flight experience was no better. The meals were terrible, and the airplanes felt outdated and poorly maintained. Save yourself the stress and avoid this airline at all costs. It’s truly not worth it, and the negative reviews you’ve read are entirely accurate.",1,Dec-24,Negative
ucazzu P,The pride of having no shame,Horrible. Still no refund for the absurd changes they imposed randomly & let no way to to find any compromise. They are just thieves... & apparently so proud to be.,1,Nov-24,Negative
Dale M,Very very bad,"Online check in wasn't working (I tried 24 hours, the following morning , and 3 hours before check in) online check in gave message that it was to check in at counter. Queue for flight was exceptionally long , only 2 counters operating and each check in was taking about 15 minutes. Took me more than 2 hours to reach counter only to be told I had been downgraded to a much later flight because they had overfilled the plane. Told them i would miss my connecting flight to the Mara. They told me to phone my travel agent , but i couldn’t do that because agent is overseas and the time difference ment office closed. The check in staff were moody and unhelpful (she didn't even say good afternoon after i greeted her). I was then pointed to a counter to get a voucher for hotel to wait for next flight. Lady at kenya airways counter said i would have to wait for all the downgraded passengers to be put onto a single voucher . This would have taken literally hours. She took a photo of my voucher and said the hotel will accept that . Caught a bus to the hotel only to be told by the hotel staff that the hotel will not accept a photo of the voucher. The hotel check in staff told me kenya airways knows this , and that they should have given me a physical voucher. Fortunately, the hotel staff went out of their way to assist and told me kenya airways often make such mistakes. As i write this , i am waiting for the next kenya airways flight , I just hope there isn’t similar issues with the next flight. I will never fly with Kenya airways again.",1,Jan-25,Negative
